,,,,,,,,,
,Company Name,Website,City,Segment,What They Make,Revenue Band,Decision Maker,DM Title,DM Background
,Achira Labs,achiralabs.com,Bengaluru,Specialty diagnostics & life-science tools,"Medical Diagnostics, Microfluidics, Microfabricatio, Instrumentation, Assay Development, Fabric assays, Public Health, and Point-of-care",Rs.50–100 Cr (Estimated),Dr. Dhananjaya Dendukuri,CEO & Co-founder,Ph.D. in Chemical Engineering from MIT (Massachusetts Institute of Technology). Biotechnology entrepreneur and microfluidics expert. Leads Achira Labs in developing point-of-care medical diagnostics.
,String Bio Pvt Ltd,stringbio.com,Bengaluru,Specialty Biotech,"Alternative Protein, Synthetic Biology, Fermentation, Sustainable Solutions, Protein for Feed, Microbial Products, Decarbonization, Personal Care, Textiles, Materials, Circular Economy, Agriculture",Rs.100–300 Cr (Estimated),Dr. Ezhil Subbian,CEO & Co-founder,Biotechnology entrepreneur and scientist with 20+ years of experience in biobased product innovation and commercialization. Co-founded String Bio in 2013
,Avesthagen Ltd,"avesthagen.com

",Bengaluru,Specialty Biote,"Genomics, biomarkers, precision medicine technologies, life science products",< Rs.50 Cr,Dr. Villoo Morawala-Patell,"Founder, Chairman & Managing Director","iotechnology entrepreneur and molecular biologist. PhD from the University of Strasbourg, former researcher at International Crops Research Institute for the Semi-Arid Tropics and National Centre for Biological Sciences. Founded Avesthagen in 1998 and leads its work in systems biology, genomics, diagnostics, precision medicine, and biotechnology innovation."
,Azooka Life,azooka.life,Bengaluru,Specialty Diagnostics & Life Science Tools,"DNA & RNA sample collection kits, genomic workflow kits, reagents, diagnostics",< Rs.50 Cr,Alex D Paul,founder,"Biotechnology entrepreneur with expertise in product management, genomics commercialization, and deep-tech startups. Co-founded Azooka with Dr. J. Fathima Benazir"
,Biocon Biologics,bioconbiologics.com,Bengaluru,Biopharmaceuticals / Biosimilars,"Biosimilar medicines for diabetes, oncology, immunology and other chronic diseases",> Rs.500 Cr,Kiran Mazumdar-Shaw,Founder & Executive Chairperson,First-generation biotechnology entrepreneur. Founded Biocon in 1978 and built it into one of the world's leading biosimilars companies
,Bionivid Technology,bione.in,Bengaluru,Genetic Testing / Microbiome Biotechnology,Personalized genetic testing and microbiome testing services for preventive healthcare,< Rs.50 C,Ashish Kumar Dubey,Co-founder & CEO,Biotechnology entrepreneur and genomics expert. Co-founded Bionivid in 2011
,Bionivid Technology,bionivid.com,Bengaluru,Genomics / Bioinformatics,"Next Generation Sequencing (NGS), Microarray Data Analytics, Genome Informatics, Bioinformatics Software and Analytics Solutions",< Rs.50 C,Ashish Kumar Dubey,Co-founder & CEO,Biotechnology entrepreneur and genomics expert. Co-founded Bionivid in 2011
,BioNome,bionome.in,Bengaluru,Genomics / Bioinformatics / Biotechnology,"Whole genome sequencing, protein and peptide sequencing, bioinformatics, drug discovery, cell culture and CRO research services",<Rs70Cr,Rajan Chourasiya,Director,"Biotechnology entrepreneur and founder of BioNome. Leads the company in genomics, bioinformatics, drug discovery, next-generation sequencing (NGS),"
,Biopol Biosciences,www.biopolbiosciences.com,Bengaluru,Biotechnology / Nutraceutical,"Develops probiotic and prebiotic ingredients for pharmaceutical, nutraceutical, and food industries.",<Rs.50Cr-100cr,Not Publicly Available,Founder / Managing Director,"Leadership information not publicly disclosed; biotechnology company focused on probiotic and prebiotic ingredients for pharmaceutical, nutraceutical, and food industries.

"
,,,,,,,,,
,BioZEEN,www.biozeen.com,Bengaluru,Biotechnology / Biopharmaceutical Engineering,"Designs and manufactures bioprocess equipment such as fermenters, bioreactors, upstream and downstream processing systems",<Rs70Cr,Mahesh Narayanan,founder,"Biotechnology entrepreneur with over 15 years of experience in life sciences, bioprocess engineering, and biopharmaceutical manufacturing. He has led BioZEEN in developing bioprocess equipment, automation, and turnkey engineering solutions for the global biopharma industry."
,"Bugworks Research
",https://bugworksresearch.com,Bengaluru,"Develops novel therapeutics for antimicrobial resistance (AMR) and immuno-oncology, focusing on innovative, affordable medicines to combat drug-resistant infections and cancer.",Biotechnology / Drug Discovery,<Rs.50Cr,Dr. Anand Anandkumar,CEO,Drug discovery scientist focused on antimicrobial resistance.
,CellKraft Biotech,www.cellkraft.in,Bengaluru,Biotechnology / Contract Research Organization (CRO),"Provides contract research services in drug screening, assay biology, medicinal chemistry, molecular diagnostics, cell culture research, 3D tissue models, and pre-clinical testing for pharmaceutical and biotechnology companies.",<RS.50cr,Siddharth Dubey,Founder,CRO and molecular diagnostics entrepreneur.
,Cemil Biosciences Pvt. Ltd.,https://www.cemilbio.com,Bengaluru,Pharmaceutical Manufacturing / Microbiology,"Manufactures high-quality microbiological culture media, ready-to-use agar plates, Petri dishes, bottles, and slants for clinical, pharmaceutical, food, and research laboratories.",<RS.50cr,Jerry Kuruvila,Founder,Microbiology and culture media manufacturing expert.
,"Cosmos Bio Private Limited
",https://cosmosbiotech.com,Bengaluru,Biotechnology / Synthetic Biology,"Develops next-generation cosmetic bioactives using synthetic biology and precision fermentation. Produces high-purity ingredients for skincare, including UV protection, anti-aging, and skin resilience applications.",<Rs.50Cr,Dr. Bharat Somireddy Venkata,founder,Synthetic biology and precision fermentation entrepreneur.
,Credora Life Sciences,http://www.credora.in,Bengaluru,Biotechnology / Molecular Diagnostics,"Provides molecular diagnostic solutions for cancer and infectious diseases, including RT-PCR, DNA sequencing, genomic services, bioinformatics, microbiology, mutation analysis, food testing, and water testing.",<Rs.50Cr,Smitha Murthy,founder,Molecular diagnostics and genomics entrepreneur.
,Criyagen Agri & Biotech Private Limited,http://www.criyagen.com,Bengaluru,Agricultural Biotechnology,"Develops eco-friendly agricultural biotechnology products, including bio-fertilizers, bio-control agents, and enriched fertilizers to improve crop productivity, soil health, and sustainable farming.",<Rs.50Cr,Dr. Basavaraj Rudrappa Girennavar,Founder,Agri-biotech entrepreneur working on biofertilizers and crop nutrition.
,Cryovault Stem Cell,https://www.cryovault.in,"Bengaluru, Karnataka",,"Provides umbilical cord blood stem cell collection, processing, preservation, and storage services for regenerative medicine and future therapeutic use.",<Rs.50Cr-100cr,Dr. Kakkireni Bharath Kumar,Founder,Healthcare entrepreneur in stem-cell banking and regenerative medicine.
,Decode Age,https://www.decodeage.com,"Bengaluru, Karnataka",Biotechnology / Longevity Health,"Develops longevity-focused health solutions, including biological age testing, epigenetic analysis, DNA-based health insights, and nutraceutical supplements aimed at healthy aging.",<Rs.50Cr,Rakesh Somani,Founder,Longevity and health-tech entrepreneur.
,Denovo Biolabs Private Limited,https://www.denovobiolabs.com,"Bengaluru, Karnataka",Biotechnology Research,"Manufactures ELISA kits, antibodies, recombinant proteins, cell culture media, diagnostic reagents",<Rs.50Cr,Dinesh kumar saini,Director,Biotechnology entrepreneur focused on research and life sciences.
,Dextrose Technologies Private Limited,https://www.dextrosetech.com,"Bengaluru, Karnataka",Biotechnology Research & Analytical Services,"Provides molecular biology, microbiology, bioinformatics, analytical testing, DNA/PCR services, cell culture",<Rs.50Cr,Aravind G,Founder,Healthcare technology and software entrepreneur.
,DSS Imagetech Pvt. Ltd.,https://www.dssimage.com,Bangalore,Medical Equipment Manufacturing,"Manufactures and distributes microscopes, clinical diagnostics systems, molecular diagnostics instruments, research imaging systems, IVF equipment.",<Rs.50Cr,Darbara Singh & Sons,founder,tem-cell researcher developing cell therapies.
,ecoGenie Biotech,https://ecogeniebiotech.com,"Bengaluru, Karnataka",Biotechnology / Sustainable Products,"Develops eco-friendly, reusable, recyclable, and compostable biotechnology-based products focused on sustainability and reducing environmental impact.",<Rs.50Cr, Harish G,Founder,"The company emphasizes sustainability and environmental responsibility, producing eco-friendly products designed to minimize waste and carbon footprint. "
,Eyestem Research,https://www.eyestem.com,"Bengaluru, Karnataka",Biotechnology / Cell & Gene Therapy,"Develops stem cell–based regenerative therapies for retinal diseases, particularly age-related macular degeneration (AMD), using retinal pigment epithelial (RPE) cell replacement technology.",<Rs.50Cr,"Dr. Jogin Desai
","
Founder",Stem-cell researcher developing cell therapies.
,Eyestem Research,https://www.eyestem.com,"Bengaluru, Karnataka",Biotechnology / Cell & Gene Therapy,"Develops stem cell–based regenerative therapies for retinal diseases, particularly age-related macular degeneration (AMD), using retinal pigment epithelial (RPE) cell replacement technology.",<Rs.50Cr,"Dr. Jogin Desai
",founder,Stem-cell researcher developing cell therapies.
,GenoPhe,https://www.genophe.com,"Bengaluru, Karnataka",Biotechnology / Nutraceuticals & Drug Discovery,"Develops science-based nutraceutical products focused on health, performance, and longevity. Also works in drug discovery, rare diseases, toxicology, and molecular biology research.",<Rs.50Cr,"T Leela Srinath, PhD Founder & CEO
","Founder
",Nutraceutical and drug discovery entrepreneur.
